title,url,thumbnail,Channel,description,views,posted
Five Nights at Freddy's: Security Breach - Part 1,https://www.youtube.com/watch?v=ClQ-ymoXJZc,https://i.ytimg.com/vi/ClQ-ymoXJZc/hqdefault.jpg?sqp=-oaymwEcCPYBEIoBSFXyq4qpAw4IARUAAIhCGAFwAcABBg==&rs=AOn4CLASED6sU-YD0JS9jRER7paz-QyZhw,Markiplier,Security Breach is HERE!! What horrors lurk in an official free roam Five Nights at Freddy's game? My Comfiest Clothes Yet ► https://cloakbrand.com/ LISTEN TO DISTRACTIBLE ►► https://podlink....,4.5M views,1 day ago
Love or Play Station? #shorts,https://www.youtube.com/shorts/-Ca8V1-ihq0,https://i.ytimg.com/vi/-Ca8V1-ihq0/hq2.jpg,PANDA BOI,New mix of my funny and entertaining videos. Follow me on other platforms for more funny videos: Instagram : https://www.instagram.com/pandaboi.com_/ Tiktok : https://www.tiktok.com/@pandaboi.com...,17M views,11 hours ago
"$1,000,000 Influencer Tournament!",https://www.youtube.com/watch?v=x9TQ6culXIA,https://i.ytimg.com/vi/x9TQ6culXIA/hqdefault.jpg?sqp=-oaymwEcCPYBEIoBSFXyq4qpAw4IARUAAIhCGAFwAcABBg==&rs=AOn4CLBoo831nfDVeib5RDxF7RfMp9gHxQ,MrBeast,That was so close at the end I can't believe that happened! ╔═╦╗╔╦╗╔═╦═╦╦╦╦╗╔═╗ ║╚╣║║║╚╣╚╣╔╣╔╣║╚╣═╣ ╠╗║╚╝║...,25M views,2 days ago
HELLUVA 2022 TRAILER,https://www.youtube.com/watch?v=Wmo8M0pNgCc,https://i.ytimg.com/vi/Wmo8M0pNgCc/hqdefault.jpg?sqp=-oaymwEcCPYBEIoBSFXyq4qpAw4IARUAAIhCGAFwAcABBg==&rs=AOn4CLAelxc55zIoUQYaeDyZD8CHLX8FnQ,Vivziepop,HAPPY HOLIDAYS EVERYONE! Thanks for supporting us for a full year of Helluva Boss! Excited to bring you more of this story in 2022! HELLUVA BOSS MERCH AVAILABLE ► https://sharkrobot.com/vivziepop...,1.6M views,1 day ago
Official JUMP FESTA Trailer | Bleach: Thousand-Year Blood War | VIZ,https://www.youtube.com/watch?v=78WIYzX_m98,https://i.ytimg.com/vi/78WIYzX_m98/hqdefault.jpg?sqp=-oaymwEcCPYBEIoBSFXyq4qpAw4IARUAAIhCGAFwAcABBg==&rs=AOn4CLBSXgbLxNtn__rqLYOGQmq8gBmZCg,vizmedia,#Bleach: Thousand-Year Blood War is finally here! Subscribe to #VIZ: https://buff.ly/2Rqfml3 Follow us on Twitter: https://twitter.com/VIZMedia Like us on Facebook: https://www.facebook.com...,1.3M views,12 hours ago
Teacher’s zipper is down… #storytime #shorts,https://www.youtube.com/shorts/JPcDj4JIdu4,,Horchata Soto,,2M views,1 day ago
Turning $0.01 Into a House in 1 Week,https://www.youtube.com/watch?v=Gxb3L8d0UtY,,Ryan Trahan,penny → house ok ok sign up for shopify → https://shopify.com/ryantrahan,1.1M views,1 day ago
"The Ultimate ""Minecraft"" Recap Cartoon",https://www.youtube.com/watch?v=rqgOzu-udFY,,Cas van de Pol,The ultimate recap cartoon of Minecraft’s Multiplayer! Follow Steve as he explores the Multiplayer hamachi server with his friends! If you want to support the channel consider signing up...,2.9M views,1 day ago
BTS Performs a Concert in the Crosswalk,https://www.youtube.com/watch?v=A8KQhwmdZIw,,The Late Late Show with James Corden,"BTS has played the world's biggest venues and stages, but James Corden has a new forum for the international sensation: the crosswalk at Beverly Blvd. and Genesee Av. Watch as the group dazzles...",7.3M views,1 day ago
Lil Durk - Broadway Girls ft Morgan Wallen (Official Audio),https://www.youtube.com/watch?v=Kpz4Ro5iD1Q,,Lil Durk,#LilDurk #MorganWallen #BroadwayGirls Stream Broadway Girls Ft Morgan Wallen: https://smarturl.it/broadwaygirls Follow Lil Durk: https://instagram.com/lildurk https://twitter.com/lildurk...,914K views,1 day ago
